{
  "version": 1,
  "id": "2026-07-08_130015-an",
  "ts": "2026-07-08T13:00:15+05:30",
  "type": "log",
  "text": "Lunch walk. Sketched the Trailhead week view on paper. Feeling steady.",
  "tags": [
    "health",
    "trailhead",
    "idea"
  ],
  "images": [
    "img/2026/07/2026-07-08_130015-an_1.jpg"
  ],
  "mood": 4,
  "processed": true
}
