{
  "version": 1,
  "id": "2026-07-08_063320-an",
  "ts": "2026-07-08T06:33:20+05:30",
  "type": "dream",
  "text": "Dreamt of a library where every book was a graph node. A fox pointed at a shelf labelled Harbor.",
  "tags": [
    "dream",
    "symbols"
  ],
  "images": [],
  "mood": 3,
  "processed": true
}
