{
  "version": 1,
  "id": "2026-07-09_201010-an",
  "ts": "2026-07-09T20:10:10+05:30",
  "type": "reflection",
  "text": "Baked bread. Read about chunking strategies for retrieval.",
  "tags": [
    "knowledge",
    "habits"
  ],
  "images": [
    "img/2026/07/2026-07-09_201010-an_1.jpg"
  ],
  "mood": 5,
  "processed": true
}
