{
  "version": 1,
  "id": "2026-07-08_230010-an",
  "ts": "2026-07-08T23:00:10+05:30",
  "type": "dream",
  "text": "I was flying over the ocean toward a lighthouse. Waves glowed blue and a fox waited on the shore.",
  "tags": ["dream", "symbols"],
  "images": [],
  "mood": 3,
  "processed": false
}
