{
  "version": 1,
  "id": "2026-07-08_220840-pc",
  "ts": "2026-07-08T22:08:40+05:30",
  "type": "reflection",
  "text": "Evenings are better when I close the laptop by 10. Want to protect deep work mornings.",
  "tags": [
    "habits",
    "work"
  ],
  "images": [],
  "mood": 4,
  "processed": true
}
